id,article_id,paragraph_number,chapeau,content_full,metadata,created_at,updated_at
89e0955a-cc1c-4f87-a2bc-6e3ccdca867d,911b222c-f1e5-4084-a574-316d66ccc5af,5,"Third countries or international organisations may become authorised participants in HealthData@EU where they comply with the rules of this Chapter and provide access to health data users located in the Union, on equivalent terms and conditions, to the electronic health data available to their health data access bodies, subject to compliance with Chapter V of Regulation (EU) 2016/679. The Commission may, by means of implementing acts, determine that a national contact point for secondary use of a third country or a system established at international level by an international organisation is compliant with the requirements of HealthData@EU for the purposes of secondary use of health data, is compliant with this Chapter and provides access to health data users located in the Union to the electronic health data it has access to on terms and conditions equivalent to those of HealthData@EU. Compliance with those legal, organisational, technical and security requirements, including with the requirements for secure processing environments provided for in Article 73 of this Regulation, shall be checked under the control of the Commission. Those implementing acts shall be adopted in accordance with the examination procedure referred to in Article 98(2) of this Regulation. The Commission shall make the list of implementing acts adopted pursuant to this paragraph publicly available.","Third countries or international organisations may become authorised participants in HealthData@EU where they comply with the rules of this Chapter and provide access to health data users located in the Union, on equivalent terms and conditions, to the electronic health data available to their health data access bodies, subject to compliance with Chapter V of Regulation (EU) 2016/679. The Commission may, by means of implementing acts, determine that a national contact point for secondary use of a third country or a system established at international level by an international organisation is compliant with the requirements of HealthData@EU for the purposes of secondary use of health data, is compliant with this Chapter and provides access to health data users located in the Union to the electronic health data it has access to on terms and conditions equivalent to those of HealthData@EU. Compliance with those legal, organisational, technical and security requirements, including with the requirements for secure processing environments provided for in Article 73 of this Regulation, shall be checked under the control of the Commission. Those implementing acts shall be adopted in accordance with the examination procedure referred to in Article 98(2) of this Regulation. The Commission shall make the list of implementing acts adopted pursuant to this paragraph publicly available.",,2025-01-01 22:50:07.249106+00,2025-01-01 22:50:07.249106+00
8a8831e7-5b09-4453-b6f2-ae6414be713a,057ba3f6-7664-45b3-b7ee-188af501ec98,2,"The Commission and Member States may facilitate the exchange of personal electronic health data with other infrastructures, such as the Clinical Patient Management System or other services or infrastructures in the health, care or social security fields which may become authorised participants in MyHealth@EU. The Commission shall, by means of implementing acts, set out the technical aspects of such exchanges. Those implementing acts shall be adopted in accordance with the examination procedure referred to in Article 98(2). The connection and disconnection of another infrastructure to the central platform for digital health shall be subject to a decision of the Commission adopted by means of an implementing act, based on the result of compliance checks of the technical aspects of exchanges as referred to in the first subparagraph of this paragraph. That implementing act shall be adopted in accordance with the examination procedure referred to in Article 98(2).","The Commission and Member States may facilitate the exchange of personal electronic health data with other infrastructures, such as the Clinical Patient Management System or other services or infrastructures in the health, care or social security fields which may become authorised participants in MyHealth@EU. The Commission shall, by means of implementing acts, set out the technical aspects of such exchanges. Those implementing acts shall be adopted in accordance with the examination procedure referred to in Article 98(2). The connection and disconnection of another infrastructure to the central platform for digital health shall be subject to a decision of the Commission adopted by means of an implementing act, based on the result of compliance checks of the technical aspects of exchanges as referred to in the first subparagraph of this paragraph. That implementing act shall be adopted in accordance with the examination procedure referred to in Article 98(2).",,2025-01-01 22:48:04.066577+00,2025-01-01 22:48:04.066577+00
8b7410b8-7ce5-4e4a-8862-38aa50e016c5,8b798654-422c-415c-bca1-f938e4393ddf,3,"Market surveillance authorities other than the market surveillance authorities initiating the procedure under this Article shall inform without delay the Commission and the other Member States’ market surveillance authorities of any measures adopted, of any additional information at their disposal relating to the non-compliance of the EHR system concerned and, in the event of disagreement with the adopted national measure, of their objections.","Market surveillance authorities other than the market surveillance authorities initiating the procedure under this Article shall inform without delay the Commission and the other Member States’ market surveillance authorities of any measures adopted, of any additional information at their disposal relating to the non-compliance of the EHR system concerned and, in the event of disagreement with the adopted national measure, of their objections.",,2025-01-01 22:48:47.141648+00,2025-01-01 22:48:47.141648+00
8bbaa5f4-413c-462e-9a37-b1d0c47cf0c8,b368813b-50e9-4095-ac6c-f5a0fbc35e4a,1,"Where a market surveillance authority of one Member State has reason to believe that an EHR system poses a risk to the health, safety or rights of natural persons or to the protection of personal data, that market surveillance authority shall carry out an evaluation in relation to the EHR system concerned covering all relevant requirements laid down in this Regulation. The manufacturer, the manufacturer's authorised representative and all other relevant economic operators shall cooperate as necessary with the market surveillance authority for that purpose and take all appropriate measures to ensure that the EHR system concerned no longer poses that risk when placed on the market or to recall or withdraw the EHR system from the market within a reasonable period.'","Where a market surveillance authority of one Member State has reason to believe that an EHR system poses a risk to the health, safety or rights of natural persons or to the protection of personal data, that market surveillance authority shall carry out an evaluation in relation to the EHR system concerned covering all relevant requirements laid down in this Regulation. The manufacturer, the manufacturer's authorised representative and all other relevant economic operators shall cooperate as necessary with the market surveillance authority for that purpose and take all appropriate measures to ensure that the EHR system concerned no longer poses that risk when placed on the market or to recall or withdraw the EHR system from the market within a reasonable period.'",,2025-01-01 22:48:41.648599+00,2025-01-01 22:48:41.648599+00
8c0292b0-f1ec-42c8-9f18-449c53819c42,ab94a0c1-0ca9-426a-81ac-1690369286d7,2,"Where health data access bodies find that a health data user or health data holder does not comply with the requirements of this Chapter, they shall immediately notify the health data user or health data holder of those findings and take appropriate measures. The health data access body concerned shall give the health data user or health data holder concerned the opportunity to state their views within a reasonable period that shall not exceed four weeks. Where the finding of non-compliance concerns a possible breach of Regulation (EU) 2016/679, the health data access body concerned shall immediately inform the supervisory authorities under that Regulation and provide them with all relevant information concerning that finding.","Where health data access bodies find that a health data user or health data holder does not comply with the requirements of this Chapter, they shall immediately notify the health data user or health data holder of those findings and take appropriate measures. The health data access body concerned shall give the health data user or health data holder concerned the opportunity to state their views within a reasonable period that shall not exceed four weeks. Where the finding of non-compliance concerns a possible breach of Regulation (EU) 2016/679, the health data access body concerned shall immediately inform the supervisory authorities under that Regulation and provide them with all relevant information concerning that finding.",,2025-01-01 22:49:28.421564+00,2025-01-01 22:49:28.421564+00
8c7ca364-1471-424c-b8e4-1a8e914c2ac4,019b7e94-f653-4acd-8348-125716032169,1,The power to adopt delegated acts is conferred on the Commission subject to the conditions laid down in this Article.,The power to adopt delegated acts is conferred on the Commission subject to the conditions laid down in this Article.,,2025-01-01 22:50:45.300439+00,2025-01-01 22:50:45.300439+00
8cbb5cae-cc4d-4421-8076-74ac726e3e2e,b368813b-50e9-4095-ac6c-f5a0fbc35e4a,2,"Where the market surveillance authorities of a Member State consider that the non-compliance of the EHR system is not limited to their national territory, they shall inform the Commission and the other Member States’ market surveillance authorities of the results of the evaluation referred to in paragraph 1 of this Article and of the corrective action which they have required the economic operator to take pursuant to Article 16(2) of Regulation (EU) 2019/1020.","Where the market surveillance authorities of a Member State consider that the non-compliance of the EHR system is not limited to their national territory, they shall inform the Commission and the other Member States’ market surveillance authorities of the results of the evaluation referred to in paragraph 1 of this Article and of the corrective action which they have required the economic operator to take pursuant to Article 16(2) of Regulation (EU) 2019/1020.",,2025-01-01 22:48:41.913171+00,2025-01-01 22:48:41.913171+00
8cd6988d-8073-4fca-be0d-d42be2cdaddf,b368813b-50e9-4095-ac6c-f5a0fbc35e4a,6,"Where a finding of a market surveillance authority, or a serious incident it is informed of, concerns personal data protection, that market surveillance authority shall without undue delay inform the relevant supervisory authorities under Regulation (EU) 2016/679 and cooperate with them.","Where a finding of a market surveillance authority, or a serious incident it is informed of, concerns personal data protection, that market surveillance authority shall without undue delay inform the relevant supervisory authorities under Regulation (EU) 2016/679 and cooperate with them.",,2025-01-01 22:48:43.040946+00,2025-01-01 22:48:43.040946+00
8d3bb8f8-1ce9-421a-bf4d-a58c66f02b10,11491988-9619-4719-b1ce-e10d2c527e9e,4,"The proxy services referred to in paragraph 2 of this Article shall be interoperable among Member States. The Commission shall, by means of implementing acts, lay down the technical specifications for the interoperability of the proxy services of the Member States. Those implementing acts shall be adopted in accordance with the examination procedure referred to in Article 98(2).","The proxy services referred to in paragraph 2 of this Article shall be interoperable among Member States. The Commission shall, by means of implementing acts, lay down the technical specifications for the interoperability of the proxy services of the Member States. Those implementing acts shall be adopted in accordance with the examination procedure referred to in Article 98(2).",,2025-01-01 22:47:36.287178+00,2025-01-01 22:47:36.287178+00
8d3fb15f-1588-463d-93d0-57c649c3b375,cec189de-9337-4f07-9b1d-82a2cd0e39fd,6,"Following the health data access body’s decision to issue the data permit or to approve the health data request, the trusted health data holder shall carry out the tasks referred to in Article 57(1), points (a)(i) and (b).","Following the health data access body’s decision to issue the data permit or to approve the health data request, the trusted health data holder shall carry out the tasks referred to in Article 57(1), points (a)(i) and (b).",,2025-01-01 22:50:00.946052+00,2025-01-01 22:50:00.946052+00
8d84ecaa-04ed-4330-87f6-6f66c846684f,747a3d9a-00b8-4e9a-aed3-21fef4a8f155,3,"The access referred to in paragraphs 1 and 2 of this Article shall include at least the priority categories of personal electronic health data referred to in Article 14. In line with the principles provided for in Article 5 of Regulation (EU) 2016/679, Member States shall establish rules providing for the categories of personal electronic health data accessible by different categories of health professionals or for different healthcare tasks. Such rules shall take into account the possibility of restrictions imposed under Article 8 of this Regulation.","The access referred to in paragraphs 1 and 2 of this Article shall include at least the priority categories of personal electronic health data referred to in Article 14. In line with the principles provided for in Article 5 of Regulation (EU) 2016/679, Member States shall establish rules providing for the categories of personal electronic health data accessible by different categories of health professionals or for different healthcare tasks. Such rules shall take into account the possibility of restrictions imposed under Article 8 of this Regulation.",,2025-01-01 22:47:42.995735+00,2025-01-01 22:47:42.995735+00
8e7ab028-0bb0-4e2a-986d-b9e8518aeab6,c2147338-ce81-4867-b866-97fabf3880e4,2,This Chapter shall not apply to general purpose software used in a healthcare environment.,This Chapter shall not apply to general purpose software used in a healthcare environment.,,2025-01-01 22:48:05.14848+00,2025-01-01 22:48:05.14848+00
8fdfe545-8ea7-4858-a321-910f39872700,e0cd7cc3-1e97-496c-8a7f-7cc7b558b8c4,1,"Manufacturers shall draw up technical documentation before the EHR system is placed on the market or put into service, and shall keep that documentation up to date.","Manufacturers shall draw up technical documentation before the EHR system is placed on the market or put into service, and shall keep that documentation up to date.",,2025-01-01 22:48:30.386238+00,2025-01-01 22:48:30.386238+00
919c6e98-38de-4792-b10d-34679edf7d36,3b93bb85-eaa7-4cb1-ab3e-f72f913f8120,2,The health data access application shall include,"The health data access application shall include the health data applicant's identity, a description of that health data applicant’s professional functions and activities, including the identity of the natural persons who would have access to the electronic health data if a data permit were issued; the health data applicant shall notify the health data access body of any update of the list of natural persons;' the purposes referred to in Article 53(1) for which access to data is applied for; a detailed explanation of the intended use of the electronic health data and expected benefit related to that use and how that benefit would contribute to the purposes referred to in Article 53(1); a description of the requested electronic health data, including their scope, time range, format, sources and, where possible, the geographical coverage where such data are requested from health data holders in several Member States or from authorised participants in HealthData@EU referred to in Article 75; a description explaining whether the electronic health data need to be made available in a pseudonymised or anonymised format; in the case of a pseudonymised format, a justification as to why the processing cannot be carried out using anonymised data; where the health data applicant intends to bring datasets already held by that health data applicant into the secure processing environment, a description of those datasets; a description of the safeguards, which are to be proportionate to the risks, planned to prevent any misuse of the electronic health data, as well as to protect the rights and interests of the health data holder and of the natural persons concerned, including to prevent any re-identification of natural persons in the dataset; a justified indication of the period during which the electronic health data are needed for processing in a secure processing environment; (i) a description of the tools and computing resources needed for a secure processing environment; a description of the tools and computing resources needed for a secure processing environment; where applicable, information on any assessment of ethical aspects of the processing, required under national law, which may serve to replace the health data applicant’s own ethics assessment; where the health data applicant intends to make use of an exception under Article 71(4), the justification required by national law pursuant to that Article.",,2025-01-01 22:49:38.608145+00,2025-01-01 22:49:38.608145+00
92ae22b3-5aa8-4232-af99-7d672028bdd1,3306718a-cfea-413c-b701-14c08dca1633,2,The health data access body with which the complaint has been lodged shall inform the complainant of the progress made in dealing with the complaint and of the decision taken on the complaint.,The health data access body with which the complaint has been lodged shall inform the complainant of the progress made in dealing with the complaint and of the decision taken on the complaint.,,2025-01-01 22:50:18.918128+00,2025-01-01 22:50:18.918128+00
9416d781-c3dc-4e6a-8684-1ff72d203d6a,d50c3fe9-34b8-4e08-8cd2-30fa9842e7a4,2,The health data access body shall also take into account the following,"The health data access body shall also take into account the following risks for national defence, security, public security and public order; the risk of undermining the confidentiality of data in governmental databases of regulatory authorities.",,2025-01-01 22:49:45.388491+00,2025-01-01 22:49:45.388491+00
965dddc7-a86a-4f4f-b6d7-d8df559c0b4a,604a59df-a09b-4b62-9a65-16100cf0996d,9,Each distributor of a wellness application for which a label has been issued shall make the label available to customers at the point of sale in electronic form .,Each distributor of a wellness application for which a label has been issued shall make the label available to customers at the point of sale in electronic form .,,2025-01-01 22:48:51.950427+00,2025-01-01 22:48:51.950427+00
970375f1-12c9-4460-977e-f74f9408cbaf,cec189de-9337-4f07-9b1d-82a2cd0e39fd,5,"The trusted health data holder shall submit the assessment it carries out pursuant to paragraph 4, accompanied by a proposal for decision, to the health data access body within two months of receipt of the health data access application or health data request from the health data access body. Within two months of receipt of the assessment, the health data access body shall issue a decision on the health data access application or health data request. The health data access body shall not be bound by the proposal submitted by the trusted health data holder.","The trusted health data holder shall submit the assessment it carries out pursuant to paragraph 4, accompanied by a proposal for decision, to the health data access body within two months of receipt of the health data access application or health data request from the health data access body. Within two months of receipt of the assessment, the health data access body shall issue a decision on the health data access application or health data request. The health data access body shall not be bound by the proposal submitted by the trusted health data holder.",,2025-01-01 22:50:00.681565+00,2025-01-01 22:50:00.681565+00
9807d217-cf51-4fc1-80ea-f0f141d6281c,d50c3fe9-34b8-4e08-8cd2-30fa9842e7a4,14,"The Commission may, by means of an implementing act, develop a logo for acknowledging the contribution of the EHDS. That implementing act shall be adopted in accordance with the examination procedure referred to in Article 98(2).","The Commission may, by means of an implementing act, develop a logo for acknowledging the contribution of the EHDS. That implementing act shall be adopted in accordance with the examination procedure referred to in Article 98(2).",,2025-01-01 22:49:51.064059+00,2025-01-01 22:49:51.064059+00
98279f1c-b43f-4064-ad21-d8c56e7c5997,475c9d36-a302-425e-85eb-da9d84537593,4,"Health data access bodies may provide support to a public sector body where it obtains data in the circumstances referred to in Article 15, point (a) or (b), of Regulation (EU) 2023/2854, in accordance with the rules laid down in that Regulation, by providing technical support to process those data or combining them with other data for joint analysis. Obligations of health data access bodies towards natural persons","Health data access bodies may provide support to a public sector body where it obtains data in the circumstances referred to in Article 15, point (a) or (b), of Regulation (EU) 2023/2854, in accordance with the rules laid down in that Regulation, by providing technical support to process those data or combining them with other data for joint analysis. Obligations of health data access bodies towards natural persons",,2025-01-01 22:49:15.255508+00,2025-01-01 22:49:15.255508+00
9a49e365-9a05-49e0-bde6-b027a9145a6e,cae0dbe2-8caa-4954-b4c2-ff42f8311db3,1,"The Commission shall perform the tasks set out in Articles 57 and 59 where the health data holders are Union institutions, bodies, offices or agencies.","The Commission shall perform the tasks set out in Articles 57 and 59 where the health data holders are Union institutions, bodies, offices or agencies.",,2025-01-01 22:49:09.387571+00,2025-01-01 22:49:09.387571+00
9a79c06c-7d7f-42c1-89c0-ceac947ada51,019b7e94-f653-4acd-8348-125716032169,3,"The power to adopt delegated acts referred to in Article 14(2), Article 49(4) and Article 78(5) may be revoked at any time by the European Parliament or by the Council. A decision to revoke shall put an end to the delegation of the power specified in that decision. It shall take effect the day following the publication of the decision in the Official Journal of the European Union or at a later date specified therein. It shall not affect the validity of any delegated acts already in force.","The power to adopt delegated acts referred to in Article 14(2), Article 49(4) and Article 78(5) may be revoked at any time by the European Parliament or by the Council. A decision to revoke shall put an end to the delegation of the power specified in that decision. It shall take effect the day following the publication of the decision in the Official Journal of the European Union or at a later date specified therein. It shall not affect the validity of any delegated acts already in force.",,2025-01-01 22:50:45.825954+00,2025-01-01 22:50:45.825954+00
9ad100a1-81b4-4753-83bb-15498e05730c,79456cbb-5118-443f-af22-5b54e3eb2891,2,The information referred to in paragraph 1 shall be provided free of charge and without delay through electronic health data access services and shall be available for at least three years from each date of access to the data. That information shall include at least the following,The information referred to in paragraph 1 shall be provided free of charge and without delay through electronic health data access services and shall be available for at least three years from each date of access to the data. That information shall include at least the following information on the healthcare provider or other individuals who accessed the personal electronic health data; the date and time of access; which personal electronic health data were accessed. (c),,2025-01-01 22:47:40.301168+00,2025-01-01 22:47:40.301168+00
