id,article_id,paragraph_number,chapeau,content_full,metadata,created_at,updated_at
4a733f57-80f5-49d9-b72e-e86077d51a2a,63c7a8e5-fc6e-4dea-a428-4438754be0d5,2,"Distributors shall ensure that, while an EHR system is under their responsibility, the EHR system is not altered in such a way that its conformity with the essential requirements laid down in Annex II and with any requirements adopted pursuant to Article 42 is jeopardised.","Distributors shall ensure that, while an EHR system is under their responsibility, the EHR system is not altered in such a way that its conformity with the essential requirements laid down in Annex II and with any requirements adopted pursuant to Article 42 is jeopardised.",,2025-01-01 22:48:23.088703+00,2025-01-01 22:48:23.088703+00
4cc60eb5-51e7-4a3a-95ca-fe31d5aa6ac3,1e34b7de-f8b3-4345-b56e-1e0fed3f38d1,8,"The Commission shall, by means of implementing acts, lay down the rules regarding the requirements of cybersecurity, technical interoperability, semantic interoperability, operations and service management in relation to the processing by the processor referred to in paragraph 7 of this Article and its responsibilities towards the controllers, in accordance with Chapter IV of Regulation (EU) 2016/679. Those implementing acts shall be adopted in accordance with the examination procedure referred to in Article 98(2).","The Commission shall, by means of implementing acts, lay down the rules regarding the requirements of cybersecurity, technical interoperability, semantic interoperability, operations and service management in relation to the processing by the processor referred to in paragraph 7 of this Article and its responsibilities towards the controllers, in accordance with Chapter IV of Regulation (EU) 2016/679. Those implementing acts shall be adopted in accordance with the examination procedure referred to in Article 98(2).",,2025-01-01 22:48:02.996354+00,2025-01-01 22:48:02.996354+00
4d2aec5f-2083-4586-8539-54a857cb0561,987242ec-93f1-4047-ad48-6f024cea1e76,6,"By ... [two years from the date of entry into force of this Regulation], the Commission shall, by means of implementing acts, set out the visual characteristics and technical specifications of the data quality and utility label, based on the elements referred to in paragraph 3 of this Article. Those implementing acts shall be adopted in accordance with the examination procedure referred to in Article 98(2) of this Regulation. Those implementing acts shall take into account the requirements in Article 10 of Regulation (EU) 2024/1689 and any adopted common specifications or harmonised standards supporting those requirements, where applicable.","By ... [two years from the date of entry into force of this Regulation], the Commission shall, by means of implementing acts, set out the visual characteristics and technical specifications of the data quality and utility label, based on the elements referred to in paragraph 3 of this Article. Those implementing acts shall be adopted in accordance with the examination procedure referred to in Article 98(2) of this Regulation. Those implementing acts shall take into account the requirements in Article 10 of Regulation (EU) 2024/1689 and any adopted common specifications or harmonised standards supporting those requirements, where applicable.",,2025-01-01 22:50:16.731773+00,2025-01-01 22:50:16.731773+00
4dd3a316-fe36-4d2f-80c2-80d675c4b508,43983cdc-1fa0-4f47-a680-af6baacf9d31,2,"In order to support the effective performance of the tasks and the exercise of the powers of the health data access bodies, Member States shall ensure that each health data access body is provided with the following elements","In order to support the effective performance of the tasks and the exercise of the powers of the health data access bodies, Member States shall ensure that each health data access body is provided with the following elements the necessary human, financial and technical resources; the necessary expertise; and the necessary premises and infrastructure. Where an assessment by ethics bodies is required under national law, those bodies shall make expertise available to the health data access body. As an alternative, Member States may provide for ethics bodies to form part of the health data access body.",,2025-01-01 22:49:07.01064+00,2025-01-01 22:49:07.01064+00
4eb70a40-e89d-4f94-96d0-bcf43e07838c,70c051e8-f35a-4d29-b1af-3e8cd701f863,2,"When processing data in an electronic format, healthcare providers shall ensure that the personal electronic health data of the natural persons under their treatment are updated with information related to the healthcare.","When processing data in an electronic format, healthcare providers shall ensure that the personal electronic health data of the natural persons under their treatment are updated with information related to the healthcare.",,2025-01-01 22:47:44.871467+00,2025-01-01 22:47:44.871467+00
4ee7c752-bd33-4392-80d8-159380f2427a,151a576c-dae3-4977-ae8b-2c0f109f2cfa,3,"If a health data holder or a health data user intentionally or negligently infringes several provisions of this Regulation for the same or a linked data permit or health data request, the total amount of the administrative fine shall not exceed the amount specified for the most serious infringement.","If a health data holder or a health data user intentionally or negligently infringes several provisions of this Regulation for the same or a linked data permit or health data request, the total amount of the administrative fine shall not exceed the amount specified for the most serious infringement.",,2025-01-01 22:49:33.755582+00,2025-01-01 22:49:33.755582+00
4f3c33ca-ce7c-43b2-9c16-02a59410ff06,d65d5790-76aa-4a86-918b-876973b7ba9f,3,"This Regulation shall be without prejudice to other Union legal acts regarding access to, and sharing of or secondary use of, electronic health data, or Union requirements related to the processing of data in relation to electronic health data, in particular Regulations (EC) No 223/2009, (EU) No 536/2014, (EU) 2016/679, (EU) 2018/1725, (EU) 2022/868 and (EU) 2023/2854 of the European Parliament and of the Council and Directives 2002/58/EC and (EU) 2016/943 of the European Parliament and of the Council.","This Regulation shall be without prejudice to other Union legal acts regarding access to, and sharing of or secondary use of, electronic health data, or Union requirements related to the processing of data in relation to electronic health data, in particular Regulations (EC) No 223/2009, (EU) No 536/2014, (EU) 2016/679, (EU) 2018/1725, (EU) 2022/868 and (EU) 2023/2854 of the European Parliament and of the Council and Directives 2002/58/EC and (EU) 2016/943 of the European Parliament and of the Council.",,2025-01-01 22:47:20.916276+00,2025-01-01 22:47:20.916276+00
521d4a65-7bf5-4c18-9a4d-0a494f6d975d,747a3d9a-00b8-4e9a-aed3-21fef4a8f155,5,"Where access to personal electronic health data has been restricted by a natural person pursuant to Article 8, the healthcare provider or health professional shall not be informed of the restricted content of those data. By way of derogation from the first paragraph of Article 8, where necessary in order to protect the vital interests of the data subject, the healthcare provider or health professional may be granted access to the restricted electronic health data. Such cases shall be logged in a clear and understandable format and shall be easily accessible for the data subject. Member States may provide for additional safeguards.","Where access to personal electronic health data has been restricted by a natural person pursuant to Article 8, the healthcare provider or health professional shall not be informed of the restricted content of those data. By way of derogation from the first paragraph of Article 8, where necessary in order to protect the vital interests of the data subject, the healthcare provider or health professional may be granted access to the restricted electronic health data. Such cases shall be logged in a clear and understandable format and shall be easily accessible for the data subject. Member States may provide for additional safeguards.",,2025-01-01 22:47:43.526519+00,2025-01-01 22:47:43.526519+00
52890f79-a08c-41a2-9434-0d636f6fc119,604a59df-a09b-4b62-9a65-16100cf0996d,2,The label referred to in paragraph 1 shall indicate the following information,The label referred to in paragraph 1 shall indicate the following information the categories of electronic health data for which compliance with essential requirements laid down in Annex II has been confirmed; a reference to common specifications to demonstrate compliance; the validity period of the label.,,2025-01-01 22:48:49.274924+00,2025-01-01 22:48:49.274924+00
52d0ce7b-73d4-4157-b116-ef0ddd782957,cab6cc2a-1486-48ea-aab3-8bd280aa84da,3,"Market surveillance authorities referred to in Article 43, the EDPB and the European Data Protection Supervisor, the European Medicines Agency, the European Centre for Disease Prevention and Control and the European Union Agency for Cybersecurity (ENISA) shall be invited to attend the meetings, where relevant according to the EHDS Board.","Market surveillance authorities referred to in Article 43, the EDPB and the European Data Protection Supervisor, the European Medicines Agency, the European Centre for Disease Prevention and Control and the European Union Agency for Cybersecurity (ENISA) shall be invited to attend the meetings, where relevant according to the EHDS Board.",,2025-01-01 22:50:30.691398+00,2025-01-01 22:50:30.691398+00
5392ecf9-37f8-4ab7-abd1-55395e583fbd,151a576c-dae3-4977-ae8b-2c0f109f2cfa,2,"Administrative fines shall, depending on the circumstances of each individual case, be imposed in addition to, or instead of, enforcement measures referred to in Article 63(3) and (4). Health data access bodies shall decide whether to impose an administrative fine and the amount of the administrative fine in each individual case by giving due regard to the following circumstances","Administrative fines shall, depending on the circumstances of each individual case, be imposed in addition to, or instead of, enforcement measures referred to in Article 63(3) and (4). Health data access bodies shall decide whether to impose an administrative fine and the amount of the administrative fine in each individual case by giving due regard to the following circumstances the nature, gravity and duration of the infringement; whether any penalties or administrative fines have already been imposed by other competent authorities for the same infringement; the intentional or negligent character of the infringement; any action taken by the health data holder or health data user to mitigate the damage caused; the degree of responsibility of the health data user, taking into account technical and organisational measures implemented by that health data user pursuant to Article 67(2), point (g), and Article 67(4); any relevant previous infringements by the health data holder or health data user; the degree of cooperation of the health data holder or health data user with the health data access body as regards remedying the infringement and mitigating its possible adverse effects; the manner in which the health data access body became aware of the infringement, in particular whether, and to what extent, the health data user notified it of the infringement; compliance with any enforcement measures referred to in Article 63(3) and (4) which have been ordered previously against the controller or processor concerned with regard to the same subject matter; any other aggravating or mitigating factor applicable to the circumstances of the case, such as financial benefits gained or losses avoided, directly or indirectly, through the infringement.",,2025-01-01 22:49:30.831264+00,2025-01-01 22:49:30.831264+00
54621095-27d7-423f-96e8-efbf51549863,cab6cc2a-1486-48ea-aab3-8bd280aa84da,6,"Depending on the functions related to the use of electronic health data, the EHDS Board may work in subgroups for certain topics, in which digital health authorities or health data access bodies shall be represented. Those subgroups shall support the EHDS Board with specific expertise and may have joint meetings, as required.","Depending on the functions related to the use of electronic health data, the EHDS Board may work in subgroups for certain topics, in which digital health authorities or health data access bodies shall be represented. Those subgroups shall support the EHDS Board with specific expertise and may have joint meetings, as required.",,2025-01-01 22:50:31.510512+00,2025-01-01 22:50:31.510512+00
54725c87-7946-46f1-8940-f17c1712fb9f,d50c3fe9-34b8-4e08-8cd2-30fa9842e7a4,11,Health data users shall have the right to access and process the electronic health data in a secure processing environment in accordance with the data permit issued to them on the basis of this Regulation.,Health data users shall have the right to access and process the electronic health data in a secure processing environment in accordance with the data permit issued to them on the basis of this Regulation.,,2025-01-01 22:49:50.245089+00,2025-01-01 22:49:50.245089+00
574afaf7-fb53-49a8-9036-3c0ee523f322,d8ef35c2-b50f-41e2-8af0-399caa41d85e,1,"Where, under Article 44(2) and Article 45(3), objections are raised against a national measure taken by a market surveillance authority, or where the Commission considers a national measure to be contrary to Union law, the Commission shall without delay enter into consultations with that market surveillance authority and the relevant economic operators and shall evaluate the national measure concerned. On the basis of the results of that evaluation, the Commission shall adopt an implementing decision determining whether the national measure is justified. That implementing decision shall be adopted in accordance with the examination procedure referred to in Article 98(2). The Commission shall address its implementing decision to all Member States and shall immediately communicate it to them and to the relevant economic operators.","Where, under Article 44(2) and Article 45(3), objections are raised against a national measure taken by a market surveillance authority, or where the Commission considers a national measure to be contrary to Union law, the Commission shall without delay enter into consultations with that market surveillance authority and the relevant economic operators and shall evaluate the national measure concerned. On the basis of the results of that evaluation, the Commission shall adopt an implementing decision determining whether the national measure is justified. That implementing decision shall be adopted in accordance with the examination procedure referred to in Article 98(2). The Commission shall address its implementing decision to all Member States and shall immediately communicate it to them and to the relevant economic operators.",,2025-01-01 22:48:48.21494+00,2025-01-01 22:48:48.21494+00
576ac245-033e-4c5e-a5c0-3c839333f06c,ab8da433-1af3-450d-973f-2a1a64f1fb58,4,"Member States may introduce stricter measures and additional safeguards at national level aimed at safeguarding the sensitivity and value of the data that fall under paragraph 1, points (f), (g), (i) and (q). Member States shall notify the Commission of those measures and safeguards and, without delay, of any subsequent amendment affecting them.","Member States may introduce stricter measures and additional safeguards at national level aimed at safeguarding the sensitivity and value of the data that fall under paragraph 1, points (f), (g), (i) and (q). Member States shall notify the Commission of those measures and safeguards and, without delay, of any subsequent amendment affecting them.",,2025-01-01 22:49:01.696037+00,2025-01-01 22:49:01.696037+00
57771040-02ff-44e9-9d76-7204151d7415,a0efa36b-fe4e-4852-817f-3102f95814c3,2,"Natural persons shall have the right, where the healthcare providers are located in different Member States, to request the transmission of their personal electronic health data in the European electronic health record exchange format referred to in Article 15 through the cross-border infrastructure referred to in Article 23. The receiving healthcare provider shall accept such data and shall be able to read them.","Natural persons shall have the right, where the healthcare providers are located in different Member States, to request the transmission of their personal electronic health data in the European electronic health record exchange format referred to in Article 15 through the cross-border infrastructure referred to in Article 23. The receiving healthcare provider shall accept such data and shall be able to read them.",,2025-01-01 22:47:38.423008+00,2025-01-01 22:47:38.423008+00
58bfac55-86ab-4113-850f-6264f371b059,0d8152f9-62bf-478a-810f-e97756a0ce9f,1,The health data applicant may submit a health data request for the purposes referred to in Article 53 with the aim of obtaining a response only in an anonymised statistical format. A health data access body shall not provide a response to a health data request in any other format and the health data user shall have no access to the electronic health data used to provide that response.,The health data applicant may submit a health data request for the purposes referred to in Article 53 with the aim of obtaining a response only in an anonymised statistical format. A health data access body shall not provide a response to a health data request in any other format and the health data user shall have no access to the electronic health data used to provide that response.,,2025-01-01 22:49:51.619692+00,2025-01-01 22:49:51.619692+00
594b5e5a-d5ca-4599-a106-e030750e41ea,f71bc902-21f2-4374-b2e2-4c5dce2fa78f,1,"Health data holders shall make relevant electronic health data referred to in Article 51 available upon request to the health data access body, in accordance with a data permit issued pursuant to Article 68, or upon a health data request approved pursuant to Article 69.","Health data holders shall make relevant electronic health data referred to in Article 51 available upon request to the health data access body, in accordance with a data permit issued pursuant to Article 68, or upon a health data request approved pursuant to Article 69.",,2025-01-01 22:49:22.675612+00,2025-01-01 22:49:22.675612+00
5a2c47ee-f08b-4a29-baae-d6d521788a0f,32c900cd-7f08-41d7-abb9-e4e66c3b4864,5,"The digital health authorities, health data access bodies and health data users shall inform the health data holder about the existence of a request of a third-country administrative authority to access its data before complying with that request, except where the request serves law enforcement purposes and for as long as compliance is necessary to preserve the effectiveness of the law enforcement activity.","The digital health authorities, health data access bodies and health data users shall inform the health data holder about the existence of a request of a third-country administrative authority to access its data before complying with that request, except where the request serves law enforcement purposes and for as long as compliance is necessary to preserve the effectiveness of the law enforcement activity.",,2025-01-01 22:50:27.278429+00,2025-01-01 22:50:27.278429+00
5a951499-defc-47e1-9f1c-c2c9dfb49202,f71bc902-21f2-4374-b2e2-4c5dce2fa78f,3,"The health data holder shall communicate to the health data access body a description of the dataset it holds in accordance with Article 77. The health data holder shall, at a minimum on an annual basis, check that its dataset description in the national dataset catalogue is accurate and up to date.","The health data holder shall communicate to the health data access body a description of the dataset it holds in accordance with Article 77. The health data holder shall, at a minimum on an annual basis, check that its dataset description in the national dataset catalogue is accurate and up to date.",,2025-01-01 22:49:23.341304+00,2025-01-01 22:49:23.341304+00
5af309d5-d471-41d0-9df4-b7d734de88e4,ab19a078-6a75-436f-994e-b52196fc6d72,8,"When the purposes of the processing of personal electronic health data by a health data holder do not or no longer require the identification of a data subject by the controller, that health data holder shall not be obliged to maintain, acquire or process additional information in order to identify the data subject for the sole purpose of complying with the right to opt out under this Article.","When the purposes of the processing of personal electronic health data by a health data holder do not or no longer require the identification of a data subject by the controller, that health data holder shall not be obliged to maintain, acquire or process additional information in order to identify the data subject for the sole purpose of complying with the right to opt out under this Article.",,2025-01-01 22:49:58.237081+00,2025-01-01 22:49:58.237081+00
5c0babc4-8d50-4f42-a46c-4061f3f92197,969804ed-25e1-4c7a-bb44-080725d80eaf,2,"Before making an EHR system available on the market, importers shall ensure that","Before making an EHR system available on the market, importers shall ensure that the manufacturer has drawn up the technical documentation referred to in Article 37 and the EU declaration of conformity; the manufacturer is identified and an authorised representative has been appointed in accordance with Article 31; the EHR system bears the CE marking of conformity referred to in Article 41 after the conformity assessment procedure has been completed; the EHR system is accompanied by the information sheet referred to in Article 38 with clear and complete instructions for use, including for its maintenance, in accessible formats.",,2025-01-01 22:48:18.266414+00,2025-01-01 22:48:18.266414+00
5da1fd6f-b7fd-44ab-9686-52e75c3acdc3,2b873eef-6844-43b8-91da-d24744a18263,6,"Where common specifications covering interoperability and security requirements of medical devices, in vitro diagnostic medical devices or high-risk AI systems falling under other legal acts, such as Regulation (EU) 2017/745, (EU) 2017/746 or (EU) 2024/1689, affect EHR systems, the Commission shall ensure that the adoption of those common specifications is preceded by a consultation with the EHDS Board and the EDPB, as applicable.","Where common specifications covering interoperability and security requirements of medical devices, in vitro diagnostic medical devices or high-risk AI systems falling under other legal acts, such as Regulation (EU) 2017/745, (EU) 2017/746 or (EU) 2024/1689, affect EHR systems, the Commission shall ensure that the adoption of those common specifications is preceded by a consultation with the EHDS Board and the EDPB, as applicable.",,2025-01-01 22:48:29.850772+00,2025-01-01 22:48:29.850772+00
5e8729e3-a056-4933-a4ce-24010a4f957d,969804ed-25e1-4c7a-bb44-080725d80eaf,3,"Importers shall indicate their name, registered trade name or registered trade mark, the postal address, website, e-mail address or other digital contact details through which they can be contacted in a document accompanying the EHR system. The contact details shall indicate a single point at which the manufacturer can be contacted and shall be in a language which can be easily understood by users and market surveillance authorities. Importers shall ensure that any additional label does not conceal or obscure any of the information provided by the manufacturer that appears on any original label which is provided for the EHR system.","Importers shall indicate their name, registered trade name or registered trade mark, the postal address, website, e-mail address or other digital contact details through which they can be contacted in a document accompanying the EHR system. The contact details shall indicate a single point at which the manufacturer can be contacted and shall be in a language which can be easily understood by users and market surveillance authorities. Importers shall ensure that any additional label does not conceal or obscure any of the information provided by the manufacturer that appears on any original label which is provided for the EHR system.",,2025-01-01 22:48:19.597387+00,2025-01-01 22:48:19.597387+00
5e9ab315-6223-4316-9d9f-913157d9e20f,d65d5790-76aa-4a86-918b-876973b7ba9f,7,"This Regulation shall be without prejudice to specific provisions in Union or national law providing for access to electronic health data for further processing by Member States’ public sector bodies, by Union institutions, bodies, offices and agencies, or by private entities entrusted under Union or national law with a task of public interest, for the purpose of carrying out such task.","This Regulation shall be without prejudice to specific provisions in Union or national law providing for access to electronic health data for further processing by Member States’ public sector bodies, by Union institutions, bodies, offices and agencies, or by private entities entrusted under Union or national law with a task of public interest, for the purpose of carrying out such task.",,2025-01-01 22:47:21.979016+00,2025-01-01 22:47:21.979016+00
60584ca1-20fc-4d99-a4ba-09e6649584db,604a59df-a09b-4b62-9a65-16100cf0996d,3,"The Commission shall, by means of implementing acts, determine the format and content of the label referred to in paragraph 1. Those implementing acts shall be adopted in accordance with the examination procedure referred to in Article 98(2).","The Commission shall, by means of implementing acts, determine the format and content of the label referred to in paragraph 1. Those implementing acts shall be adopted in accordance with the examination procedure referred to in Article 98(2).",,2025-01-01 22:48:50.371359+00,2025-01-01 22:48:50.371359+00
