id,article_id,paragraph_number,chapeau,content_full,metadata,created_at,updated_at
000eda32-8708-4a24-94ab-bd816aa825aa,a1e6d435-5b54-45f8-8ddd-b9a21925d0a1,2,"By way of exception from paragraph 1 of this Article, the data referred to in that paragraph may be stored and processed in a third country, or a territory or one or more specified sectors within that third country, where such country, territory or sector is covered by an adequacy decision adopted pursuant to Article 45 of Regulation (EU) 2016/679.","By way of exception from paragraph 1 of this Article, the data referred to in that paragraph may be stored and processed in a third country, or a territory or one or more specified sectors within that third country, where such country, territory or sector is covered by an adequacy decision adopted pursuant to Article 45 of Regulation (EU) 2016/679.",,2025-01-01 22:50:24.07855+00,2025-01-01 22:50:24.07855+00
004bf382-5114-42d5-9714-b0e6d0a6f66a,cae0dbe2-8caa-4954-b4c2-ff42f8311db3,2,"The Commission shall ensure that the necessary human, technical and financial resources, premises and infrastructure are allocated for the effective performance of the tasks set out in Articles 57 and 59 and the exercise of its duties.","The Commission shall ensure that the necessary human, technical and financial resources, premises and infrastructure are allocated for the effective performance of the tasks set out in Articles 57 and 59 and the exercise of its duties.",,2025-01-01 22:49:09.646692+00,2025-01-01 22:49:09.646692+00
00d12b38-eca7-4ae2-accf-4415be79ad51,d50c3fe9-34b8-4e08-8cd2-30fa9842e7a4,12,"A data permit shall be issued for the duration necessary to fulfil the requested purposes and that duration shall not exceed 10 years. That duration may be extended once for a period which does not exceed 10 years, at the request of the health data user, based on arguments and documents to justify that extension which shall be provided one month before the expiry of the data permit. The health data access body may charge fees which increase to reflect the costs and risks of storing electronic health data for a period exceeding the initial period. In order to reduce such costs and fees, the health data access body may also propose to the health data user to store the dataset in a storage system with reduced capabilities. Such reduced capabilities shall not affect the security of the processed dataset. The electronic health data within the secure processing environment shall be deleted within six months of the expiry of the data permit. At the request of the health data user, the formula for the creation of the requested dataset may be stored by the health data access body.","A data permit shall be issued for the duration necessary to fulfil the requested purposes and that duration shall not exceed 10 years. That duration may be extended once for a period which does not exceed 10 years, at the request of the health data user, based on arguments and documents to justify that extension which shall be provided one month before the expiry of the data permit. The health data access body may charge fees which increase to reflect the costs and risks of storing electronic health data for a period exceeding the initial period. In order to reduce such costs and fees, the health data access body may also propose to the health data user to store the dataset in a storage system with reduced capabilities. Such reduced capabilities shall not affect the security of the processed dataset. The electronic health data within the secure processing environment shall be deleted within six months of the expiry of the data permit. At the request of the health data user, the formula for the creation of the requested dataset may be stored by the health data access body.",,2025-01-01 22:49:50.510691+00,2025-01-01 22:49:50.510691+00
0244fa59-784d-401c-b84a-c5aed2c54ce3,ce5b3ae6-7e68-47eb-92c7-3c935d09c6d1,main,"by means of implementing acts, set out the templates for the health data access application, the data permit and the health data request referred to in Articles 67, 68 and 69, respectively. Those implementing acts shall be adopted in accordance with the examination procedure referred to in Article 98(2).","by means of implementing acts, set out the templates for the health data access application, the data permit and the health data request referred to in Articles 67, 68 and 69, respectively. Those implementing acts shall be adopted in accordance with the examination procedure referred to in Article 98(2).",,2025-01-01 22:49:54.927714+00,2025-01-01 22:49:54.927714+00
02ba5ec8-272b-4c46-a80b-653d2404bbb8,3b93bb85-eaa7-4cb1-ab3e-f72f913f8120,4,"When seeking access to the personal electronic health data in a pseudonymised format, the health data applicant shall provide, together with the health data access application, a description of how the processing would comply with applicable Union and national law on data protection and privacy, in particular with Regulation (EU) 2016/679 and, more specifically, with Article 6(1) thereof.","When seeking access to the personal electronic health data in a pseudonymised format, the health data applicant shall provide, together with the health data access application, a description of how the processing would comply with applicable Union and national law on data protection and privacy, in particular with Regulation (EU) 2016/679 and, more specifically, with Article 6(1) thereof.",,2025-01-01 22:49:42.143841+00,2025-01-01 22:49:42.143841+00
057e87bb-70f3-4c61-bf10-24a6308237e4,019b7e94-f653-4acd-8348-125716032169,2,"The power to adopt delegated acts referred to in Article 14(2), Article 49(4) and Article 78(5) shall be conferred on the Commission for an indeterminate period of time from ... [date of entry into force of this Regulation].","The power to adopt delegated acts referred to in Article 14(2), Article 49(4) and Article 78(5) shall be conferred on the Commission for an indeterminate period of time from ... [date of entry into force of this Regulation].",,2025-01-01 22:50:45.562261+00,2025-01-01 22:50:45.562261+00
05b1b7e2-6912-49ae-b1d5-8466f29d7542,0d8152f9-62bf-478a-810f-e97756a0ce9f,2,A health data request as referred to in paragraph 1 shall include the following information,"A health data request as referred to in paragraph 1 shall include the following information the identity of the health data applicant and a description of that health data applicant’s professional functions and activities; a detailed explanation of the intended use of the electronic health data, including the purposes referred to in Article 53(1) for which the health data request is submitted; a description of the requested electronic health data, their format and the sources of those data, where possible; a description of the statistical content; a description of the safeguards planned to prevent any misuse of the requested electronic health data; a description of how the processing would comply with Article 6(1) of Regulation (EU) 2016/679 or Article 5(1) and Article 10(2) of Regulation (EU) 2018/1725; where the health data applicant intends to make use of an exception under Article 71(4), the justification required in that regard by national law pursuant to that Article.",,2025-01-01 22:49:51.885009+00,2025-01-01 22:49:51.885009+00
05ef2b66-c8f7-4b71-b2f2-173e37544e61,6a901601-1450-432e-aab5-7f661cc61a22,2,The information sheet referred to in paragraph 1 shall specify,"The information sheet referred to in paragraph 1 shall specify the identity, registered trade name or registered trademark, and contact details of the manufacturer and, where applicable, of its authorised representative; the name and version of the EHR system and date of its release; the intended purpose of the EHR system; the categories of electronic health data that the EHR system has been designed to process; the standards, formats and specifications supported by the EHR system and versions of those standards, formats and specifications.",,2025-01-01 22:48:32.005426+00,2025-01-01 22:48:32.005426+00
061fbb76-37d3-4efd-afce-a0e01eb3dee4,911b222c-f1e5-4084-a574-316d66ccc5af,13,"Where there is a positive outcome of the compliance check referred to in paragraph 5 of this Article, the Commission may, by means of implementing acts, take decisions to connect individual authorised participants to HealthData@EU. Those implementing acts shall be adopted in accordance with the examination procedure referred to in Article 98(2).","Where there is a positive outcome of the compliance check referred to in paragraph 5 of this Article, the Commission may, by means of implementing acts, take decisions to connect individual authorised participants to HealthData@EU. Those implementing acts shall be adopted in accordance with the examination procedure referred to in Article 98(2).",,2025-01-01 22:50:11.025994+00,2025-01-01 22:50:11.025994+00
063b1f11-e987-4fa3-9f5d-dcd0274e82f7,5f4a2dbc-d72d-45c9-a16e-d042d8afc876,2,"The Commission shall, by means of implementing acts, determine the requirements for the interoperable, cross-border identification and authentication mechanism for natural persons and health professionals, in accordance with Regulation (EU) No 910/2014. That mechanism shall facilitate the transferability of personal electronic health data in a cross-border context. Those implementing acts shall be adopted in accordance with the examination procedure referred to in Article 98(2).","The Commission shall, by means of implementing acts, determine the requirements for the interoperable, cross-border identification and authentication mechanism for natural persons and health professionals, in accordance with Regulation (EU) No 910/2014. That mechanism shall facilitate the transferability of personal electronic health data in a cross-border context. Those implementing acts shall be adopted in accordance with the examination procedure referred to in Article 98(2).",,2025-01-01 22:47:51.297318+00,2025-01-01 22:47:51.297318+00
0660ba91-759f-4b36-95ab-a4a1c2b0213a,11491988-9619-4719-b1ce-e10d2c527e9e,5,"The electronic health data access services and the proxy services shall be easily accessible for persons with disabilities, vulnerable groups and persons with low digital literacy. Right of natural persons to insert information in their own EHR","The electronic health data access services and the proxy services shall be easily accessible for persons with disabilities, vulnerable groups and persons with low digital literacy. Right of natural persons to insert information in their own EHR",,2025-01-01 22:47:36.546752+00,2025-01-01 22:47:36.546752+00
08043aa1-e9a0-47dc-96e8-dfcbad428d7f,fd1dddfd-0602-4c9f-af3f-31343d37d758,2,"The dataset descriptions in the national dataset catalogue shall be available in at least one official language of the Union. The dataset catalogue for Union institutions, bodies, offices and agencies provided by the Union health data access service shall be available in all official languages of the Union.","The dataset descriptions in the national dataset catalogue shall be available in at least one official language of the Union. The dataset catalogue for Union institutions, bodies, offices and agencies provided by the Union health data access service shall be available in all official languages of the Union.",,2025-01-01 22:50:12.665483+00,2025-01-01 22:50:12.665483+00
0899944f-ff02-4f76-b5f4-3305007db30b,cab6cc2a-1486-48ea-aab3-8bd280aa84da,4,"The EHDS Board may invite national authorities, experts and observers as well as Union institutions, bodies, offices and agencies, in addition to those referred to in paragraph 3, and research infrastructures and other similar infrastructures to attend its meetings.","The EHDS Board may invite national authorities, experts and observers as well as Union institutions, bodies, offices and agencies, in addition to those referred to in paragraph 3, and research infrastructures and other similar infrastructures to attend its meetings.",,2025-01-01 22:50:30.962054+00,2025-01-01 22:50:30.962054+00
08f1f8cb-86d4-4502-8b80-f5e7b98d5a52,46b4ef88-e3b1-4de9-880e-3180cd18b47c,2,The EHDS Board shall have the following tasks related to secondary use in accordance with Chapter IV,"The EHDS Board shall have the following tasks related to secondary use in accordance with Chapter IV assisting Member States in coordinating practices of health data access bodies in the implementation of provisions set out in Chapter IV, to ensure a consistent application of this Regulation; issuing written contributions and exchanging best practices on matters related to the coordination of the implementation at Member State level of this Regulation and of the delegated and implementing acts adopted pursuant to it, in particular as regards: creating, in consultation and cooperation with relevant stakeholders, including representatives of patients, health professionals and researchers, guidelines in order to help health data users to fulfil their duties under Article 61(5), and in particular to determine whether their findings are clinically significant; facilitating cooperation between health data access bodies through capacity building, establishing the framework for activity-reporting referred to in Article 59(1), and the exchange of information; sharing information concerning risks and incidents related to secondary use, as well as the handling of such risks and incidents; facilitating the exchange of views on secondary use with the stakeholder forum referred to in Article 93, as well as with health data holders, health data users, regulators and policy makers in the health sector.",,2025-01-01 22:50:36.834615+00,2025-01-01 22:50:36.834615+00
0934d6ff-e879-477c-8ba7-2fc4285d4213,1e34b7de-f8b3-4345-b56e-1e0fed3f38d1,2,"Each Member State shall designate one national contact point for digital health, as an organisational and technical gateway for the provision of services linked to the cross-border exchange of personal electronic health data in the context of primary use. Each national contact point for digital health shall be connected to all other national contact points for digital health in other Member States and to the central interoperability platform for digital health in the cross-border infrastructure MyHealth@EU. Where a national contact point for digital health is an entity consisting of multiple organisations responsible for implementing different services, the Member State concerned shall communicate to the Commission a description of the distribution of tasks between the organisations. Each Member State shall inform the Commission of the identity of its national contact point for digital health by ... [the date of entry into force of this Regulation + 24 months]. The national contact point for digital health may be designated within the digital health authority referred to in Article 19. Member States shall inform the Commission of any subsequent modification of the identity of those national contact points for digital health. The Commission and the Member States shall make that information publicly available.","Each Member State shall designate one national contact point for digital health, as an organisational and technical gateway for the provision of services linked to the cross-border exchange of personal electronic health data in the context of primary use. Each national contact point for digital health shall be connected to all other national contact points for digital health in other Member States and to the central interoperability platform for digital health in the cross-border infrastructure MyHealth@EU. Where a national contact point for digital health is an entity consisting of multiple organisations responsible for implementing different services, the Member State concerned shall communicate to the Commission a description of the distribution of tasks between the organisations. Each Member State shall inform the Commission of the identity of its national contact point for digital health by ... [the date of entry into force of this Regulation + 24 months]. The national contact point for digital health may be designated within the digital health authority referred to in Article 19. Member States shall inform the Commission of any subsequent modification of the identity of those national contact points for digital health. The Commission and the Member States shall make that information publicly available.",,2025-01-01 22:48:01.396822+00,2025-01-01 22:48:01.396822+00
097c8823-9639-454b-84d9-a4db1fa5329a,7c189853-9cca-4a10-b0de-a467f19be1c8,main,"healthcare provider for making personal electronic health data available. A healthcare provider or a third party shall not directly or indirectly charge data subjects a fee or costs, or require compensation, for sharing or accessing data. Section 2 Governance for primary use","healthcare provider for making personal electronic health data available. A healthcare provider or a third party shall not directly or indirectly charge data subjects a fee or costs, or require compensation, for sharing or accessing data. Section 2 Governance for primary use",,2025-01-01 22:47:52.866634+00,2025-01-01 22:47:52.866634+00
0a88d975-857e-4e22-b079-46e484005fb2,7321eadb-b1be-4743-8499-a816e9dfd004,main,"Member States shall lay down the rules on penalties applicable to infringements of this Regulation, in particular for infringements which are not subject to administrative fines pursuant to Articles 63 and 64, and shall take all measures necessary to ensure that they are implemented. The penalties provided for shall be effective, proportionate and dissuasive. Member States shall, by ... [the date of entry into force of this Regulation + 24 months], notify the Commission of those rules and of those measures and shall notify it, without delay, of any subsequent amendment affecting them. Member States shall take into account the following non-exhaustive and indicative criteria for the imposition of penalties for infringements of this Regulation, where appropriate: (a) (b) (c) (d) the nature, gravity, scale and duration of the infringement; any action taken by the infringer to mitigate or remedy the damage caused by the infringement; any previous infringements by the infringer; the financial benefits gained or losses avoided by the infringer due to the infringement, insofar as such benefits or losses can be reliably established; (e) any other aggravating or mitigating factors applicable to the circumstances of the case; (f) the infringer's annual turnover in the Union in the preceding financial year.'","Member States shall lay down the rules on penalties applicable to infringements of this Regulation, in particular for infringements which are not subject to administrative fines pursuant to Articles 63 and 64, and shall take all measures necessary to ensure that they are implemented. The penalties provided for shall be effective, proportionate and dissuasive. Member States shall, by ... [the date of entry into force of this Regulation + 24 months], notify the Commission of those rules and of those measures and shall notify it, without delay, of any subsequent amendment affecting them. Member States shall take into account the following non-exhaustive and indicative criteria for the imposition of penalties for infringements of this Regulation, where appropriate: (a) (b) (c) (d) the nature, gravity, scale and duration of the infringement; any action taken by the infringer to mitigate or remedy the damage caused by the infringement; any previous infringements by the infringer; the financial benefits gained or losses avoided by the infringer due to the infringement, insofar as such benefits or losses can be reliably established; (e) any other aggravating or mitigating factors applicable to the circumstances of the case; (f) the infringer's annual turnover in the Union in the preceding financial year.'",,2025-01-01 22:50:47.91053+00,2025-01-01 22:50:47.91053+00
0b9f5e41-15b8-4592-a617-3b9ab9994b55,7cb20a7e-1d08-4786-a8ed-12dcbb535f30,4,"The stakeholder forum may establish standing or temporary subgroups, as appropriate, for the purpose of examining specific questions related to the objectives of this Regulation. The stakeholder forum shall adopt its rules of procedure.","The stakeholder forum may establish standing or temporary subgroups, as appropriate, for the purpose of examining specific questions related to the objectives of this Regulation. The stakeholder forum shall adopt its rules of procedure.",,2025-01-01 22:50:34.179274+00,2025-01-01 22:50:34.179274+00
0bac0cf8-1f35-40a1-82d7-0ceea697c536,475c9d36-a302-425e-85eb-da9d84537593,2,"In the exercise of their tasks, health data access bodies shall","In the exercise of their tasks, health data access bodies shall cooperate with supervisory authorities under Regulation (EU) 2016/679 in relation to personal electronic health data and the EHDS Board; cooperate with all relevant stakeholders, including patient organisations, representatives of natural persons, health professionals, researchers, and ethics committees, where applicable in accordance with Union or national law; cooperate with other national competent bodies, including the national competent authorities supervising data altruism organisations under Regulation (EU) 2022/868, the competent authorities under Regulation (EU) 2023/2854 and the national competent authorities under Regulations (EU) 2017/745, (EU) 2017/746 and (EU) 2024/1689, where relevant.",,2025-01-01 22:49:13.936766+00,2025-01-01 22:49:13.936766+00
0be7952f-ee87-47e6-84de-5aa513a2d4e9,d50c3fe9-34b8-4e08-8cd2-30fa9842e7a4,5,"When handling a health data access application for cross-border access to electronic health data referred to in Article 67(3), health data access bodies and relevant authorised participants in HealthData@EU referred to in Article 75 shall remain responsible for adopting decisions to grant or refuse access to electronic health data within their remit in accordance with this Chapter. The health data access bodies and authorised participants in HealthData@EU concerned shall inform each other of their decisions. They may take that information into consideration when deciding on granting or refusing access to electronic health data. A data permit issued by one health data access body may benefit from mutual recognition by the other health data access bodies.","When handling a health data access application for cross-border access to electronic health data referred to in Article 67(3), health data access bodies and relevant authorised participants in HealthData@EU referred to in Article 75 shall remain responsible for adopting decisions to grant or refuse access to electronic health data within their remit in accordance with this Chapter. The health data access bodies and authorised participants in HealthData@EU concerned shall inform each other of their decisions. They may take that information into consideration when deciding on granting or refusing access to electronic health data. A data permit issued by one health data access body may benefit from mutual recognition by the other health data access bodies.",,2025-01-01 22:49:46.753501+00,2025-01-01 22:49:46.753501+00
0c0bb8de-4f66-421c-9416-0b4cbeaf23a2,adbc6171-0fd8-4d53-a671-08d2fde0631b,4,"Where health data holders and health data users do not agree on the level of the fees within one month of the data permit being issued, the health data access body may set the fees in proportion to the cost of making electronic health data available for secondary use. Where health data holders or health data users disagree with the fee set by the health data access body, they shall have access to dispute settlement bodies in accordance with Article 10 of Regulation (EU) 2023/2854.","Where health data holders and health data users do not agree on the level of the fees within one month of the data permit being issued, the health data access body may set the fees in proportion to the cost of making electronic health data available for secondary use. Where health data holders or health data users disagree with the fee set by the health data access body, they shall have access to dispute settlement bodies in accordance with Article 10 of Regulation (EU) 2023/2854.",,2025-01-01 22:49:27.08839+00,2025-01-01 22:49:27.08839+00
0ecc799e-93dc-415d-bdb4-e3e6603078b0,79456cbb-5118-443f-af22-5b54e3eb2891,1,"Natural persons shall have the right to obtain information, including through automatic notifications, on any access to their personal electronic health data through the health professional access service obtained in the context of healthcare, including access provided in accordance with Article 11(5).","Natural persons shall have the right to obtain information, including through automatic notifications, on any access to their personal electronic health data through the health professional access service obtained in the context of healthcare, including access provided in accordance with Article 11(5).",,2025-01-01 22:47:40.019307+00,2025-01-01 22:47:40.019307+00
